{
  "$schema": "https://json-schema.org/draft/2020-12/schema",
  "$id": "https://schemas.ifccad.org/ifcdr/json-mapping-meta-schema-v5.json",
  "type": "object",
  "properties": {
    "$schema": {
      "type": "string",
      "minLength": 1
    },
    "mappingSchemaVersion": {
      "const": "ifccad.ifcdr.jsonMapping.v5"
    },
    "ifcdrVersion": {
      "type": "string",
      "minLength": 1
    },
    "resource": {
      "type": "object",
      "properties": {
        "constants": {
          "type": "object",
          "additionalProperties": {
            "type": "string",
            "minLength": 1
          }
        },
        "fields": {
          "type": "array",
          "items": {
            "oneOf": [
              {
                "type": "object",
                "properties": {
                  "logical": {
                    "type": "string",
                    "minLength": 1
                  },
                  "payload": {
                    "type": "string",
                    "minLength": 1
                  },
                  "omission": {
                    "enum": [
                      "forbidden",
                      "logicalDefault"
                    ]
                  }
                },
                "required": [
                  "logical",
                  "payload",
                  "omission"
                ],
                "additionalProperties": false
              },
              {
                "type": "object",
                "properties": {
                  "logical": {
                    "type": "string",
                    "minLength": 1
                  },
                  "encoding": {
                    "const": "pointPoolRange"
                  },
                  "offset": {
                    "type": "string",
                    "minLength": 1
                  },
                  "count": {
                    "type": "string",
                    "minLength": 1
                  },
                  "pools": {
                    "type": "array",
                    "items": {
                      "type": "string",
                      "minLength": 1
                    },
                    "uniqueItems": true,
                    "minItems": 2,
                    "maxItems": 3
                  }
                },
                "required": [
                  "logical",
                  "encoding",
                  "offset",
                  "count",
                  "pools"
                ],
                "additionalProperties": false
              },
              {
                "type": "object",
                "properties": {
                  "logical": {
                    "type": "string",
                    "minLength": 1
                  },
                  "encoding": {
                    "const": "childRange"
                  },
                  "offset": {
                    "type": "string",
                    "minLength": 1
                  },
                  "count": {
                    "type": "string",
                    "minLength": 1
                  },
                  "target": {
                    "type": "string",
                    "minLength": 1
                  },
                  "targetStream": {
                    "type": "string",
                    "minLength": 1
                  }
                },
                "required": [
                  "logical",
                  "encoding",
                  "offset",
                  "count"
                ],
                "oneOf": [
                  {
                    "required": [
                      "target"
                    ]
                  },
                  {
                    "required": [
                      "targetStream"
                    ]
                  }
                ],
                "additionalProperties": false
              }
            ]
          }
        }
      },
      "required": [
        "constants",
        "fields"
      ],
      "additionalProperties": false
    },
    "directory": {
      "type": "object",
      "properties": {
        "schemaId": {
          "type": "string",
          "minLength": 1
        },
        "payload": {
          "type": "string",
          "minLength": 1
        },
        "fields": {
          "type": "array",
          "items": {
            "type": "string",
            "minLength": 1
          },
          "uniqueItems": true
        },
        "entryFields": {
          "type": "array",
          "items": {
            "type": "string",
            "minLength": 1
          },
          "uniqueItems": true
        },
        "optionalEntryFields": {
          "type": "array",
          "items": {
            "type": "string",
            "minLength": 1
          },
          "uniqueItems": true
        }
      },
      "required": [
        "schemaId",
        "payload",
        "fields",
        "entryFields",
        "optionalEntryFields"
      ],
      "additionalProperties": false
    },
    "tables": {
      "type": "array",
      "items": {
        "type": "object",
        "properties": {
          "name": {
            "type": "string",
            "minLength": 1
          },
          "payload": {
            "type": "string",
            "minLength": 1
          },
          "omission": {
            "enum": [
              "forbidden",
              "logicalDefault"
            ]
          },
          "fields": {
            "type": "array",
            "items": {
              "oneOf": [
                {
                  "type": "object",
                  "properties": {
                    "logical": {
                      "type": "string",
                      "minLength": 1
                    },
                    "payload": {
                      "type": "string",
                      "minLength": 1
                    },
                    "omission": {
                      "enum": [
                        "forbidden",
                        "logicalDefault"
                      ]
                    }
                  },
                  "required": [
                    "logical",
                    "payload",
                    "omission"
                  ],
                  "additionalProperties": false
                },
                {
                  "type": "object",
                  "properties": {
                    "logical": {
                      "type": "string",
                      "minLength": 1
                    },
                    "encoding": {
                      "const": "pointPoolRange"
                    },
                    "offset": {
                      "type": "string",
                      "minLength": 1
                    },
                    "count": {
                      "type": "string",
                      "minLength": 1
                    },
                    "pools": {
                      "type": "array",
                      "items": {
                        "type": "string",
                        "minLength": 1
                      },
                      "uniqueItems": true,
                      "minItems": 2,
                      "maxItems": 3
                    }
                  },
                  "required": [
                    "logical",
                    "encoding",
                    "offset",
                    "count",
                    "pools"
                  ],
                  "additionalProperties": false
                },
                {
                  "type": "object",
                  "properties": {
                    "logical": {
                      "type": "string",
                      "minLength": 1
                    },
                    "encoding": {
                      "const": "childRange"
                    },
                    "offset": {
                      "type": "string",
                      "minLength": 1
                    },
                    "count": {
                      "type": "string",
                      "minLength": 1
                    },
                    "target": {
                      "type": "string",
                      "minLength": 1
                    },
                    "targetStream": {
                      "type": "string",
                      "minLength": 1
                    }
                  },
                  "required": [
                    "logical",
                    "encoding",
                    "offset",
                    "count"
                  ],
                  "oneOf": [
                    {
                      "required": [
                        "target"
                      ]
                    },
                    {
                      "required": [
                        "targetStream"
                      ]
                    }
                  ],
                  "additionalProperties": false
                }
              ]
            }
          }
        },
        "required": [
          "name",
          "payload",
          "omission",
          "fields"
        ],
        "additionalProperties": false
      }
    },
    "streams": {
      "type": "array",
      "items": {
        "type": "object",
        "properties": {
          "name": {
            "type": "string",
            "minLength": 1
          },
          "payload": {
            "type": "string",
            "minLength": 1
          },
          "fields": {
            "type": "array",
            "items": {
              "oneOf": [
                {
                  "type": "object",
                  "properties": {
                    "logical": {
                      "type": "string",
                      "minLength": 1
                    },
                    "payload": {
                      "type": "string",
                      "minLength": 1
                    },
                    "omission": {
                      "enum": [
                        "forbidden",
                        "logicalDefault"
                      ]
                    },
                    "nullEncoding": {
                      "const": "logicalDefault"
                    }
                  },
                  "required": [
                    "logical",
                    "payload",
                    "omission"
                  ],
                  "additionalProperties": false
                },
                {
                  "type": "object",
                  "properties": {
                    "logical": {
                      "type": "string",
                      "minLength": 1
                    },
                    "encoding": {
                      "const": "pointPoolRange"
                    },
                    "offset": {
                      "type": "string",
                      "minLength": 1
                    },
                    "count": {
                      "type": "string",
                      "minLength": 1
                    },
                    "pools": {
                      "type": "array",
                      "items": {
                        "type": "string",
                        "minLength": 1
                      },
                      "uniqueItems": true,
                      "minItems": 2,
                      "maxItems": 3
                    }
                  },
                  "required": [
                    "logical",
                    "encoding",
                    "offset",
                    "count",
                    "pools"
                  ],
                  "additionalProperties": false
                },
                {
                  "type": "object",
                  "properties": {
                    "logical": {
                      "type": "string",
                      "minLength": 1
                    },
                    "encoding": {
                      "const": "childRange"
                    },
                    "offset": {
                      "type": "string",
                      "minLength": 1
                    },
                    "count": {
                      "type": "string",
                      "minLength": 1
                    },
                    "target": {
                      "type": "string",
                      "minLength": 1
                    },
                    "targetStream": {
                      "type": "string",
                      "minLength": 1
                    }
                  },
                  "required": [
                    "logical",
                    "encoding",
                    "offset",
                    "count"
                  ],
                  "oneOf": [
                    {
                      "required": [
                        "target"
                      ]
                    },
                    {
                      "required": [
                        "targetStream"
                      ]
                    }
                  ],
                  "additionalProperties": false
                }
              ]
            }
          }
        },
        "required": [
          "name",
          "payload",
          "fields"
        ],
        "additionalProperties": false
      }
    },
    "valueMappings": {
      "type": "object",
      "properties": {
        "appearanceMode": {
          "type": "object",
          "properties": {
            "ByLayer": {
              "const": 0
            },
            "Explicit": {
              "const": 1
            },
            "ByBlock": {
              "const": 2
            }
          },
          "required": [
            "ByLayer",
            "Explicit",
            "ByBlock"
          ],
          "additionalProperties": false
        },
        "scopeKind": {
          "type": "object",
          "properties": {
            "ModelSpace": {
              "const": 0
            },
            "PaperSpace": {
              "const": 1
            },
            "BlockDefinition": {
              "const": 2
            }
          },
          "required": [
            "ModelSpace",
            "PaperSpace",
            "BlockDefinition"
          ],
          "additionalProperties": false
        },
        "blockScaling": {
          "type": "object",
          "properties": {
            "Any": {
              "const": 0
            },
            "Uniform": {
              "const": 1
            }
          },
          "required": [
            "Any",
            "Uniform"
          ],
          "additionalProperties": false
        },
        "projectionMode": {
          "const": {
            "Orthographic": 0,
            "Perspective": 1
          }
        },
        "frontClipMode": {
          "const": {
            "Disabled": 0,
            "AtCamera": 1,
            "AtDistance": 2
          }
        },
        "backClipMode": {
          "const": {
            "Disabled": 0,
            "AtDistance": 1
          }
        },
        "viewportRenderMode": {
          "const": {
            "TwoDimensional": 0,
            "Wireframe": 1,
            "HiddenLine": 2,
            "FlatShadedWithoutEdges": 3,
            "FlatShadedWithEdges": 4,
            "SmoothShadedWithoutEdges": 5,
            "SmoothShadedWithEdges": 6
          }
        },
        "shadedPlotMode": {
          "const": {
            "AsDisplayed": 0,
            "Wireframe": 1,
            "Hidden": 2,
            "Rendered": 3
          }
        },
        "shadedPlotQualityMode": {
          "const": {
            "Draft": 0,
            "Preview": 1,
            "Normal": 2,
            "Presentation": 3,
            "Maximum": 4,
            "Custom": 5
          }
        },
        "ucsChoiceKind": {
          "const": {
            "World": 0,
            "Named": 1,
            "Unnamed": 2
          }
        },
        "gridStyle": {
          "const": {
            "Lines": 0,
            "Dots": 1
          }
        },
        "snapStyle": {
          "const": {
            "Rectangular": 0,
            "Isometric": 1
          }
        },
        "isometricPlane": {
          "const": {
            "Left": 0,
            "Top": 1,
            "Right": 2
          }
        },
        "paperActiveKind": {
          "const": {
            "Canvas": 0,
            "Viewport": 1
          }
        }
      },
      "required": [
        "appearanceMode",
        "scopeKind",
        "blockScaling",
        "projectionMode",
        "frontClipMode",
        "backClipMode",
        "viewportRenderMode",
        "shadedPlotMode",
        "shadedPlotQualityMode",
        "ucsChoiceKind",
        "gridStyle",
        "snapStyle",
        "isometricPlane",
        "paperActiveKind"
      ],
      "additionalProperties": false
    },
    "$comment": {
      "type": "string"
    }
  },
  "required": [
    "$schema",
    "mappingSchemaVersion",
    "ifcdrVersion",
    "resource",
    "directory",
    "tables",
    "streams",
    "valueMappings"
  ],
  "additionalProperties": false,
  "$comment": "Normative interpretation: ./json-mapping-v4.md"
}
