{
  "$schema": "./json-mapping-meta-schema-v5.json",
  "mappingSchemaVersion": "ifccad.ifcdr.jsonMapping.v5",
  "ifcdrVersion": "0.12.0",
  "resource": {
    "constants": {
      "header.format": "openaec.ifcdr",
      "header.version": "0.12.0"
    },
    "fields": [
      {
        "logical": "resource.resourceId",
        "payload": "header.resourceId",
        "omission": "forbidden"
      },
      {
        "logical": "resource.unit",
        "payload": "header.unit",
        "omission": "forbidden"
      },
      {
        "logical": "resource.nextEntityId",
        "payload": "header.nextEntityId",
        "omission": "forbidden"
      },
      {
        "logical": "resource.drawingViewState",
        "payload": "drawingViewState",
        "omission": "logicalDefault"
      }
    ]
  },
  "directory": {
    "schemaId": "ifccad.ifcdr.streamDirectory.v1",
    "payload": "streamDirectory",
    "fields": [
      "version",
      "streams"
    ],
    "entryFields": [
      "name",
      "schema",
      "role",
      "count",
      "columns"
    ],
    "optionalEntryFields": [
      "parent",
      "children"
    ]
  },
  "tables": [
    {
      "name": "appearanceBinding",
      "payload": "appearanceBindings",
      "omission": "logicalDefault",
      "fields": [
        {
          "logical": "appearanceBinding.id",
          "payload": "id",
          "omission": "forbidden"
        },
        {
          "logical": "appearanceBinding.ifcxAppearance",
          "payload": "ifcxAppearance",
          "omission": "forbidden"
        },
        {
          "logical": "appearanceBinding.colorMode",
          "payload": "colorMode",
          "omission": "forbidden"
        },
        {
          "logical": "appearanceBinding.opacityMode",
          "payload": "opacityMode",
          "omission": "forbidden"
        },
        {
          "logical": "appearanceBinding.linePatternMode",
          "payload": "linePatternMode",
          "omission": "forbidden"
        },
        {
          "logical": "appearanceBinding.lineWeightMode",
          "payload": "lineWeightMode",
          "omission": "forbidden"
        },
        {
          "logical": "appearanceBinding.overrideId",
          "payload": "overrideId",
          "omission": "forbidden"
        }
      ]
    },
    {
      "name": "appearanceOverride",
      "payload": "appearanceOverrides",
      "omission": "logicalDefault",
      "fields": [
        {
          "logical": "appearanceOverride.id",
          "payload": "id",
          "omission": "forbidden"
        },
        {
          "logical": "appearanceOverride.color",
          "payload": "color",
          "omission": "forbidden"
        },
        {
          "logical": "appearanceOverride.opacity",
          "payload": "opacity",
          "omission": "forbidden"
        },
        {
          "logical": "appearanceOverride.ifcxLinePattern",
          "payload": "ifcxLinePattern",
          "omission": "forbidden"
        },
        {
          "logical": "appearanceOverride.lineWeight",
          "payload": "lineWeight",
          "omission": "forbidden"
        }
      ]
    },
    {
      "name": "layerBinding",
      "payload": "layerBindings",
      "omission": "logicalDefault",
      "fields": [
        {
          "logical": "layerBinding.id",
          "payload": "id",
          "omission": "forbidden"
        },
        {
          "logical": "layerBinding.ifcxLayer",
          "payload": "ifcxLayer",
          "omission": "forbidden"
        }
      ]
    },
    {
      "name": "scope",
      "payload": "scopeTable",
      "omission": "forbidden",
      "fields": [
        {
          "logical": "scope.id",
          "payload": "id",
          "omission": "forbidden"
        },
        {
          "logical": "scope.kind",
          "payload": "kind",
          "omission": "forbidden"
        },
        {
          "logical": "scope.bounds",
          "payload": "bounds",
          "omission": "forbidden"
        }
      ]
    },
    {
      "name": "blockDefinition",
      "payload": "blockDefinitionTable",
      "omission": "logicalDefault",
      "fields": [
        {
          "logical": "blockDefinition.scopeId",
          "payload": "scopeId",
          "omission": "forbidden"
        },
        {
          "logical": "blockDefinition.name",
          "payload": "name",
          "omission": "forbidden"
        },
        {
          "logical": "blockDefinition.basePoint",
          "payload": "basePoint",
          "omission": "logicalDefault"
        },
        {
          "logical": "blockDefinition.description",
          "payload": "description",
          "omission": "logicalDefault"
        },
        {
          "logical": "blockDefinition.anonymous",
          "payload": "anonymous",
          "omission": "logicalDefault"
        },
        {
          "logical": "blockDefinition.insertionUnit",
          "payload": "insertionUnit",
          "omission": "logicalDefault"
        },
        {
          "logical": "blockDefinition.explodable",
          "payload": "explodable",
          "omission": "logicalDefault"
        },
        {
          "logical": "blockDefinition.scaling",
          "payload": "scaling",
          "omission": "logicalDefault"
        }
      ]
    },
    {
      "name": "ucsDefinition",
      "payload": "ucsDefinitionTable",
      "omission": "logicalDefault",
      "fields": [
        {
          "logical": "ucsDefinition.ucsId",
          "payload": "ucsId",
          "omission": "forbidden"
        },
        {
          "logical": "ucsDefinition.name",
          "payload": "name",
          "omission": "forbidden"
        },
        {
          "logical": "ucsDefinition.frame",
          "payload": "frame",
          "omission": "forbidden"
        },
        {
          "logical": "ucsDefinition.elevation",
          "payload": "elevation",
          "omission": "forbidden"
        }
      ]
    },
    {
      "name": "modelWindow",
      "payload": "modelWindowTable",
      "omission": "logicalDefault",
      "fields": [
        {
          "logical": "modelWindow.modelWindowId",
          "payload": "modelWindowId",
          "omission": "forbidden"
        },
        {
          "logical": "modelWindow.rectangle",
          "payload": "rectangle",
          "omission": "forbidden"
        },
        {
          "logical": "modelWindow.view",
          "payload": "view",
          "omission": "forbidden"
        },
        {
          "logical": "modelWindow.aspectRatio",
          "payload": "aspectRatio",
          "omission": "forbidden"
        },
        {
          "logical": "modelWindow.renderMode",
          "payload": "renderMode",
          "omission": "forbidden"
        },
        {
          "logical": "modelWindow.grid",
          "payload": "grid",
          "omission": "forbidden"
        },
        {
          "logical": "modelWindow.snap",
          "payload": "snap",
          "omission": "forbidden"
        },
        {
          "logical": "modelWindow.storedUcs",
          "payload": "storedUcs",
          "omission": "forbidden"
        },
        {
          "logical": "modelWindow.useStoredUcs",
          "payload": "useStoredUcs",
          "omission": "forbidden"
        }
      ]
    },
    {
      "name": "paperCanvas",
      "payload": "paperCanvasTable",
      "omission": "logicalDefault",
      "fields": [
        {
          "logical": "paperCanvas.scopeId",
          "payload": "scopeId",
          "omission": "forbidden"
        },
        {
          "logical": "paperCanvas.view",
          "payload": "view",
          "omission": "forbidden"
        },
        {
          "logical": "paperCanvas.grid",
          "payload": "grid",
          "omission": "forbidden"
        },
        {
          "logical": "paperCanvas.snap",
          "payload": "snap",
          "omission": "forbidden"
        },
        {
          "logical": "paperCanvas.storedUcs",
          "payload": "storedUcs",
          "omission": "forbidden"
        },
        {
          "logical": "paperCanvas.currentUcs",
          "payload": "currentUcs",
          "omission": "forbidden"
        },
        {
          "logical": "paperCanvas.activeContext",
          "payload": "activeContext",
          "omission": "forbidden"
        }
      ]
    },
    {
      "name": "viewportWorkspace",
      "payload": "viewportWorkspaceTable",
      "omission": "logicalDefault",
      "fields": [
        {
          "logical": "viewportWorkspace.viewportEntityId",
          "payload": "viewportEntityId",
          "omission": "forbidden"
        },
        {
          "logical": "viewportWorkspace.grid",
          "payload": "grid",
          "omission": "forbidden"
        },
        {
          "logical": "viewportWorkspace.snap",
          "payload": "snap",
          "omission": "forbidden"
        },
        {
          "logical": "viewportWorkspace.storedUcs",
          "payload": "storedUcs",
          "omission": "forbidden"
        },
        {
          "logical": "viewportWorkspace.useStoredUcs",
          "payload": "useStoredUcs",
          "omission": "forbidden"
        }
      ]
    }
  ],
  "streams": [
    {
      "name": "point",
      "payload": "streams.pointStream",
      "fields": [
        {
          "logical": "point.entityId",
          "payload": "entityId",
          "omission": "forbidden"
        },
        {
          "logical": "point.scopeId",
          "payload": "scopeId",
          "omission": "forbidden"
        },
        {
          "logical": "point.placement",
          "payload": "placement",
          "omission": "logicalDefault",
          "nullEncoding": "logicalDefault"
        },
        {
          "logical": "point.layerId",
          "payload": "layerId",
          "omission": "forbidden"
        },
        {
          "logical": "point.appearanceId",